question,condition,faithfulness,answer_relevancy,context_precision
In which city are the headquarters of the American research and scientific development company where Ravi Sethi worked as computer scientist located?,agentic,0.75,0.6481792276110073,0.99999999995
What is the full name of the viral respiratory disease in which Yi Guan's research helped to prevent the outbreak of?,agentic,1.0,0.7189611120716058,0.9999999999666667
Which Kentucky Writers Hall of Fame author has had works published by Dim Gray Bar Press?,agentic,1.0,0.6672884159918734,0.99999999995
What director worked with Vikram Bhatt on a film starring actors Rajneesh Duggal and Adah Sharma?,agentic,0.5,0.0,0.0
 Robert Smith founded the multinational company headquartered in what city?,agentic,0.6666666666666666,0.48527209516512576,0.699999999965
What amount was the settlement that the character from the Son of al Quada got in 2017?,agentic,0.6,0.6672846638663458,0.9999999999
"Considered the strongest recorded tropical cyclone, which cyclone had a film made about it in 2007?",agentic,1.0,0.7981142321027171,0.0
The 2000 British film Snatch was later adapted into a television series for what streaming service?,agentic,0.6666666666666666,0.9601118024119247,0.3333333333
Chris Williams last played for which football club from the National League North?,agentic,1.0,0.790042855315145,0.0
Who designed the hotel that held the IFBB professional bodybuilding competition in September 1991?,agentic,0.6666666666666666,0.0,0.0
"At the 71st Golden Globe Awards for television in 2013, what achievement did Breaking Bad, police sitcom Brooklyn Nine-Nine and American Hustle attain?",agentic,0.0,0.6506861094467168,0.9999999999
Which actor does American Beauty and American Beauty have in common?,agentic,0.5,0.0,0.7555555555303703
Onika Tanya Maraj is a judge on a television show hosted by whom? ,agentic,1.0,0.529937377349773,0.3333333333
Are Hot Rod and The Memory of Our People both magazines?,agentic,1.0,0.555184008325647,0.99999999995
Who was Chamberlain and Colonel of the military staff of The Merrie Monarch?,agentic,0.75,0.7043644474430469,0.9999999999
"Who has written more than 300 papers, Semyon Aranovich Gershgorin or Pavel Alexandrov?",agentic,0.5,0.8096580263134657,0.499999999975
Which post DC Extended Universe actress will also play a role in what is intended to be the fifth installment of the DC Extended Universe?,agentic,1.0,0.8190338055335356,0.8666666666377778
Who was the captain of the only battleship to provide gunfire support during the Vietnam War?,agentic,0.0,0.0,0.8333333332916666
"The Polar Bears featuring the voice of Armie Hammer, is also the same voice actor for which character in Cars 3?",agentic,0.3333333333333333,0.6882588396086301,0.5833333333041666
"Which tower is taller, 712 Fifth Avenue or Manhattan Life Insurance Building?",agentic,1.0,0.7841844127987119,0.49999999995
"Is the Pakistan fast bowler who joined the Kent County Cricket Club in June, 2011 a left-hand or right-hand batsmans?",agentic,0.5,0.5566361261465417,0.49999999995
"Who was born first, Arthur Conan Doyle or Penelope Lively?",agentic,1.0,0.9563852110188819,0.0
The Tennessee Volunteers football team plays as a member for a conference in what city?,agentic,0.5,0.9171763009718612,0.49999999995
Ernest Foot was the best friend of the fighter pilot who had how many victories?,agentic,0.5,0.62026906156171,0.0
"From March 631 to April 631, Farrukhzad Khosrau V was the king of an empire that succeeded which empire?",agentic,1.0,0.6307140512542643,0.0
Which suburb is a soap opera featuring a character named Beverly Marshall set in?,agentic,0.6666666666666666,0.0,0.999999999975
Which country did the Falkland Islands beat in the 2010 Commonwealth games that has eleven administrative divisions?,agentic,1.0,0.4973374264811577,0.0
"Which Netflix series ""Unbreakable"" character is Elizabeth Claire Kemper known for playing?",agentic,1.0,0.7380154105597311,0.999999999975
"Which television series featured an actor who also performed in ""The Young Ones""?",agentic,1.0,0.46119279662489054,0.9999999999
Are both Dafeng District and Dazhou located in the same province?,agentic,0.75,0.4723591553643893,0.9999999999
"In what century did this Native warrior and chief, whose brother Tenskwatawa led the Tippecanoe order of battle, become the primary leader of a large, multi tribal confederacy?",agentic,0.3333333333333333,0.34481308003874883,0.699999999965
What film was written and directed by Joby Harold with music written by Samuel Sim?,agentic,0.3333333333333333,0.4920280627015446,0.99999999995
What is the name of the ethnic group who settled in Canada in the 17th century that participated in a conflict with Irish Catholic immigrants in the Shiners' War?,agentic,0.5,0.0,0.49999999995
The author of The Thing of It Is... is what Nationality?,agentic,1.0,0.9408196971418263,0.7555555555303703
"How long is the bridge in the Öresund Region that connect Copenhagen, Denmark and Malmo, Sweden?",agentic,1.0,0.7765035080708346,0.99999999995
"Martin Patterson ""Pat"" Hingle was a close friend of an actor who achieved success in what Western TV series? ",agentic,0.5,0.521756030460539,0.99999999995
Is the Marsilea or the Brabejum the genus of more individual species of plants?,agentic,1.0,0.7935910216457732,0.6388888888675925
What building is opposite the ceremonial meeting place of the Accession Council in the United Kingdom?,agentic,1.0,0.5809441420350412,0.5833333333041666
"What material did a hairdresser from Yorkshire, England invent that was named by his granddaughter?",agentic,1.0,0.4691738388674728,0.99999999995
One Raffles Place is one of the tallest skyscrapers in the city of Singapore and tallest in the wolrd outside North America until it was succeeded by a Building in city?,agentic,1.0,0.851698874545324,0.0
"Which case came first, Craig v. Boren or United States v. Paramount Pictures, Inc.?",agentic,1.0,0.785144391200372,0.9999999999
What is the nickname of the city where Darling's Waterfront Pavilion is located?,agentic,1.0,0.4908292408557229,0.9999999999666667
The Kansas City Wizards have had three home venues in Kansas City in their time.  Which was their first?,agentic,0.5,0.6930973443129546,0.6999999999766667
"Henry Hall is known for fighting in the Revolutionary War, and for being the first to successfully cultivate this food found in what type of bogs?",agentic,1.0,0.561879270553126,0.99999999995
A scam involving a male calling small town fast-food restaurants and pretending to be a police officer to have them strip search employees was turned into a movie of what name?,agentic,0.75,0.5049418989487734,0.99999999995
"What airport serviced by American Airlines Shuttle, is also the largest airport in the New England region and 17th busiest in the U.S?",agentic,1.0,0.9449491970564896,0.99999999995
"Which genus has more species, Xanthoceras or Ehretia?",agentic,1.0,0.8060623094743038,0.9999999999
What arcade game is named after the only player in major league history to have a 0.300 batting average for 7 consecutive seasons?,agentic,1.0,0.5100442214636226,0.3333333333
What american actress/singer born in 1956 recorded the song Something there for beauty and the beast?,agentic,1.0,0.8184220245229094,0.3333333333
Which professional baseball player and National 1993 Baseball Hall of Fame inductee is featured in the Greatest Sports Legends anthology? ,agentic,1.0,0.4291788718108455,0.99999999995
Salisbury Woodland Gardens links a zoo with a park designed and built under the watchful eye of who?,agentic,1.0,0.544637285737407,0.9999999999
What class of instrument does Apatim Majumdar play?,agentic,1.0,0.6217357030401931,0.7555555555303703
Jamie Harris is best known for his role as The Hook-Handed Man in a movie directed by who ?,agentic,0.75,0.41929728290964263,0.0
"How many laps did Harry Prowell run during the 10,000 metres race at the 1967 Pan American Games?",agentic,0.5,0.9979446603229482,0.49999999995
Are  Chrysalis and Look both women's magazines?,agentic,1.0,0.7403756847891493,0.49999999995
"Which author has won more Pulitzer Prizes, Thomas Friedman or Henri Bergson?",agentic,0.0,0.7915543557759922,0.0
"Yoann Lemoine, a French video director, has created music videos for Lana Del Rey, Katy Perry, and an orchestral country pop ballad by which top pop artist?",agentic,0.5,0.7023969221238434,0.99999999995
In what city can a person find both the Nusretiye Clock Tower and the Eski Imaret Mosque be found?,agentic,0.75,0.8560028709634765,0.8666666666377778
"What is Opry Mills in Nashville, Tennessee?",agentic,1.0,0.7963277833175421,0.9999999999
"Spaceware Sky Division II is manufactured by this subsidiary, which is one of twelve subdivisions of Inner Mongolia, China?",agentic,,0.6820207885464787,0.99999999995
"Which director had the longest career, Alain Resnais or Scott Sidney?",agentic,0.42857142857142855,0.0,0.49999999995
"in 1999, Spirit Halloween LLC was purchased by a mall retailer that has how many stores in the United States and Canada ?",agentic,1.0,0.747591115572306,0.49999999995
James Fieser received his B.A. from what liberal arts work college that was founded in 1855?,agentic,1.0,0.8186887732627067,0.99999999995
What year did Roy Rogers and his third wife star in a film directed by Frank McDonald?,agentic,0.3333333333333333,0.0,0.49999999995
" The name ""Mountbatten-Windsor"" applies to male-line descendants of the Queen without royal styles and titles which is a Eurpean dynasty resulting in what family?",agentic,0.3333333333333333,0.8141976649453376,0.8666666666377778
Who is known for producing the documentary television series based on the book by science historian James Burke?,agentic,1.0,0.6771131878343781,0.94999999997625
which is larger Asante Traditional Buildings or Gulangyu?,agentic,0.6666666666666666,0.9263130192198372,0.49999999995
Armageddon in Retrospect was written by the author who was best known for what 1969 satire novel?,agentic,1.0,0.5157881025755053,0.99999999995
Patrick Kennedy is known for his collections of Irish  folktales from a province situated in which part of Ireland ?,agentic,1.0,0.6762141594026599,0.9166666666361111
What NIFL Premier Intermediate League team did Sean Connor play for?,agentic,0.0,0.0,0.9999999999
"Which character does this protagonist, who secretly loves and marries a member of the rival house, of William Shakespeare's tragedy that has a fictional character Benvolio slay?",agentic,0.0,0.6021265363069345,0.9999999999
"What was the name of the fanzine that interviewed the Sex Pistols bassist when he was in the band ""The Flowers of Romance?""",agentic,0.5,0.8051959778282236,0.9999999999
"What, known as AAS, is commonly used in bodybuilding?",agentic,1.0,0.8469445955144921,0.999999999975
"Which American character actor who starred on the television series ""Stargate SG-1"" (1997–2007) and appeared in ""Episode 8"" of ""Twin Peaks"" as a guest star?",agentic,0.5,0.36542660417789424,0.9999999999
Candy Coburn has shared the stage with an American country music group with who playing guitar?,agentic,0.3333333333333333,0.8278269667065062,0.3333333333
What is the population according to the 2007 population census of the city in which the National Archives and Library of Ethiopia is located?,agentic,1.0,0.8627970417039199,0.49999999995
Which composer created Night Ferry first performed in 2012 at Symphony Center in Chicago?,agentic,1.0,0.7466436724913983,0.9999999999
To which aircraft carrier was the VMF-213 Marine Fighting Squadron assigned to durning World War II?,agentic,1.0,0.6649773458831084,0.8333333332916666
Can Stenocereus and Pachypodium both include tree like plants?,agentic,1.0,0.9019180618141508,0.9999999999
What movie did Pitof direct which had an action-adventure tie-in video game based off of it in 2004?,agentic,1.0,0.6264347976792076,0.99999999995
"on 16 January 1995 ""First Knight"" was being filmed at a studio located how far from Windsor ?",agentic,1.0,0.6667601390162646,0.9999999999
"What is the name of the actress who has received a Drama Desk award and was part of the cast album for the 2007 Broadway production of the hit musical, ""Grease""?",agentic,1.0,0.5422127947690556,0.99999999995
"Marion Greene was a health policy analyst for St. Judt Medical company, which had how many principal operations worldwide?",agentic,1.0,0.6370726070703437,0.49999999995
Which Genus has more species Eucryphia or Lepidozamia ?,agentic,1.0,0.9365294833663929,0.49999999995
"In what city was the Italian Baroque composer who composed a set of sonatas, titled Op. 5, born?",agentic,0.0,0.0,0.9999999999
"Meaning ""reddish water"" in Hawaiian, which location was Butch Van Artsdalen known for surfing 25-foot waves at?",agentic,1.0,0.5027052229395209,0.999999999975
What type of magazine is Eugene Habecker the chairman of?,agentic,1.0,0.5289614292414839,0.699999999965
"Flyboys stars which actor who was nominated for an Academy Award for ""127 Hours""?",agentic,1.0,0.8055446831826102,0.94999999997625
"The English actor Kris Marshall played which character in the highly rated comedy-drama television series ""Death in Paradise""?",agentic,1.0,0.6822986274772869,0.9166666666361111
In what month was the relief first officer of the flight that crashed on its way to Cairo with a stop in New York Born?,agentic,0.5,0.5214705830797497,0.4499999999775
Which film was released first: Sacred Planet or Oz the Great and Powerful?,agentic,0.75,0.5377522644125853,0.9999999999
I'd Come for You is a single by the band formed in what Alberta city?,agentic,0.3333333333333333,0.0,0.6791666666496875
"Who is older, Ferdi Taygan or Mahesh Bhupathi?",agentic,0.5,0.9566206175435384,0.699999999965
"Other than racing, what sport does the 1998 champion of the Toyota GRand Prix practice?",agentic,0.5,0.0,0.0
Where did Ian Harland study prior to studying at the oldest college at the University of Cambridge?,agentic,0.5,0.8753365450001777,0.9999999999
In what 1997 American mystery crime film did Johnny Galecki start in?,agentic,1.0,0.7593010817493419,0.99999999995
"Which came to market first, ""Hey Pa! There's a Goat on the Roof"" or ""Poleconomy""",agentic,1.0,0.6388509646739772,0.49999999995
What record did the Super Bowl XXXIV champions finish the regular-season with in 1999?,agentic,1.0,0.6568051181141926,0.49999999995
What is the population of the town at the intersection of Interstate Highways 77 and  the longest Interstate highway within the borders of Virginia?,agentic,1.0,0.46878833301884376,0.49999999995
What was the nickname of the hitman hired by an Italian American Criminal Organization?,agentic,1.0,0.6031200179564532,0.249999999975
What was the position of Jean Baptiste Androuet du Cerceau under the man who was King of the Polish-Lithuanian Commonwealth from 1573 to 1575?,agentic,1.0,0.5324781490394196,0.0
"Which American music star appeared as a guest in a Will & Grace episode called ""Back Up, Dancer""?",agentic,1.0,0.7287992854947684,0.9999999999
What army did the namesake of the ship launched as the München in 1930 fight in during the American Revolutionary War?,agentic,1.0,,0.9999999999666667
The Church of the Guanche People was founded in the city that is on the most populated island of what larger area?,agentic,1.0,0.8664152436552836,0.99999999995
What officially ended the first phase of the military conflict between the British Raj and the Emirate of Afghanistan from 1878 to 1880?,agentic,1.0,0.8052528912419676,0.9999999999666667
"The mass killing that took place at Oakland, California on April 2, 2012 was less deadly than the one that took place on October 1, 2015 in which state?",agentic,0.5,0.0,0.9999999999
"When did the rock band that sang ""All Join Hands"" rise to prominence? ",agentic,1.0,0.4664509397191581,0.5833333333041666
